{
    "$schema": "https://hyperlink.surf/schemas/StaticIdentityRecord_v2.json",
    "version": 2,
    "uuid": "cba40157-41c7-4cd0-8cc1-976c950c952c",
    "identity": "ollie@hyperlink.surf",
    "created_at": 1782827964967,
    "status": "active",
    "auth": {
        "password_deriv": {
            "algorithm": "argon2",
            "custom": {
                "salt": "ofQfgZWpHKt70/vv588TVQ==",
                "iv": "+9WNwiZqs9few7yx"
            }
        },
        "encrypted_private_key": "VHrPbDxPjrCLOCEpQT+vO8QtaqfydBHLUGKCLhlgXQUyXCRKHbSs5CKy+PDZVAAonbtwBVb3ErKoBoIR6QBzAihara9umqdRAP26/67lEASErUawK9Yrf7ahD4dTecF6bmIQr9oj3t8+EPT3H1RpMblMD5S5VGFNmxUmELxBOP4c8id6Bd94M25HXE2uqWWcXcXdz+lBT1GBP+yYA1sQQ8ccLuh0jxKu7ae2RPKcok9GzIDamgLtI5LjReKzmhA=",
        "public_key": {
            "kty": "OKP",
            "crv": "Ed25519",
            "x": "mSpYpb2e6ufVa4HJUUmecdPEwqn-Bg4zHn7_CNW6CG4",
            "ext": true
        }
    }
}
